{
  "backend": "doe_metal",
  "configPath": "bench/fixtures/cts_subset.fawn-node.json",
  "ctsRevision": "untracked",
  "ctsSource": "bench/fixtures/cts_subset.fawn-node.json",
  "generatedAtUtc": "2026-03-27T20:26:56.290174Z",
  "host": "mac.lan",
  "os": "darwin-25.3.0",
  "results": [
    {
      "bucket": "adapter",
      "exitCode": 1,
      "id": "adapter_request",
      "notes": "RequestAdapter behavior and option handling.",
      "query": "webgpu:api,operation,adapter,requestAdapter:*",
      "status": "fail",
      "wallMs": 539.0077498741448
    },
    {
      "bucket": "adapter",
      "exitCode": 1,
      "id": "adapter_request_device",
      "notes": "RequestDevice behavior and feature/limit negotiation.",
      "query": "webgpu:api,operation,adapter,requestDevice:*",
      "status": "fail",
      "wallMs": 754.4209170155227
    },
    {
      "bucket": "buffer",
      "exitCode": 1,
      "id": "buffer_map",
      "notes": "Core mapAsync and mapped range behavior.",
      "query": "webgpu:api,operation,buffers,map:*",
      "status": "fail",
      "wallMs": 991.4290830492973
    },
    {
      "bucket": "buffer",
      "exitCode": 1,
      "id": "buffer_bind_group",
      "notes": "Buffer binding compatibility inside bind groups.",
      "query": "webgpu:api,operation,buffers,createBindGroup:*",
      "status": "fail",
      "wallMs": 1026.334875030443
    },
    {
      "bucket": "command_buffer",
      "exitCode": 1,
      "id": "command_buffer_basic",
      "notes": "Encoder lifecycle and basic command-buffer execution.",
      "query": "webgpu:api,operation,command_buffer,basic:*",
      "status": "fail",
      "wallMs": 973.8692080136389
    },
    {
      "bucket": "command_buffer",
      "exitCode": 1,
      "id": "command_copy_buffer_to_buffer",
      "notes": "Core buffer copy semantics.",
      "query": "webgpu:api,operation,command_buffer,copyBufferToBuffer:*",
      "status": "fail",
      "wallMs": 969.5544999558479
    },
    {
      "bucket": "queue",
      "exitCode": 1,
      "id": "queue_write_buffer",
      "notes": "CPU-to-GPU upload path correctness.",
      "query": "webgpu:api,operation,queue,writeBuffer:*",
      "status": "fail",
      "wallMs": 958.9318330399692
    },
    {
      "bucket": "queue",
      "exitCode": 1,
      "id": "queue_on_submitted_work_done",
      "notes": "Queue completion semantics.",
      "query": "webgpu:api,operation,onSubmittedWorkDone:*",
      "status": "fail",
      "wallMs": 1053.1530000735074
    },
    {
      "bucket": "compute",
      "exitCode": 1,
      "id": "compute_basic",
      "notes": "Basic compute pipeline and dispatch behavior.",
      "query": "webgpu:api,operation,compute,basic:*",
      "status": "fail",
      "wallMs": 976.7453330568969
    },
    {
      "bucket": "validation",
      "exitCode": 1,
      "id": "validation_error_scope",
      "notes": "Error scope push/pop correctness.",
      "query": "webgpu:api,validation,error_scope:*",
      "status": "fail",
      "wallMs": 599.7348329983652
    },
    {
      "bucket": "validation",
      "exitCode": 1,
      "id": "validation_buffer_create",
      "notes": "Buffer descriptor validation.",
      "query": "webgpu:api,validation,buffer,create:*",
      "status": "fail",
      "wallMs": 991.3238750305027
    },
    {
      "bucket": "shader_execution",
      "exitCode": 1,
      "id": "shader_texture_dimensions",
      "notes": "WGSL builtin execution coverage already used in the prior subset.",
      "query": "webgpu:shader,execution,expression,call,builtin,textureDimensions:*",
      "status": "fail",
      "wallMs": 1189.0608749818057
    }
  ],
  "schemaVersion": 1,
  "summary": {
    "bucketSummary": {
      "adapter": {
        "failCount": 2,
        "passCount": 0,
        "queryCount": 2,
        "skipCount": 0
      },
      "buffer": {
        "failCount": 2,
        "passCount": 0,
        "queryCount": 2,
        "skipCount": 0
      },
      "command_buffer": {
        "failCount": 2,
        "passCount": 0,
        "queryCount": 2,
        "skipCount": 0
      },
      "compute": {
        "failCount": 1,
        "passCount": 0,
        "queryCount": 1,
        "skipCount": 0
      },
      "queue": {
        "failCount": 2,
        "passCount": 0,
        "queryCount": 2,
        "skipCount": 0
      },
      "shader_execution": {
        "failCount": 1,
        "passCount": 0,
        "queryCount": 1,
        "skipCount": 0
      },
      "validation": {
        "failCount": 2,
        "passCount": 0,
        "queryCount": 2,
        "skipCount": 0
      }
    },
    "failCount": 12,
    "passCount": 0,
    "passRate": 0.0,
    "queryCount": 12,
    "skipCount": 0
  }
}
